<?xml version="1.0" encoding="UTF-8" standalone="no"?>
<config xmlns="http://www.w3schools.com" xmlns:xsi="http://www.w3.org/2001/XMLSchema-instance" created="17.02.2014" id="default" xsi:noNamespaceSchemaLocation="PsdSlowControlConfig.xsd" xsi:schemaLocation="PsdSlowControlConfig.xsd">
<global>
	<title>VETO DCS</title>
	<flags>
            <onlineModules> 1 </onlineModules>
            <queryDelay unit="sec">600</queryDelay>
            <verbose> 1 </verbose>
            <monitorHV> 0 </monitorHV>
            <refTemp> 25 </refTemp>
            <tempSlope> 60 </tempSlope>

        </flags>
        <connection>
            <hvsys id='05'>
                <rate unit="baud">57600</rate>
                <host>10.18.88.104</host>
                <port>4001</port>
                <dataBits>8</dataBits>
                <stopBits>1</stopBits>
                <parity>0</parity>                
            </hvsys>
        </connection>
        <settings>
            <hv>
                <base unit="Volts">64.0</base>
            </hv>
        </settings>
    </global>

    <module id="1" version="DM64_V2">
        <geometry>
            <size>1</size>
            <x>3</x>
            <y>4</y>
        </geometry>
                 
        <connection>
            <hvsys id='05'>
                <hv>
                    <id>1</id>
                </hv>
            </hvsys>
        </connection>    
        <settings>
            <hv>
                <channel id="1" unit="Volts">42.00</channel>
                <channel id="2" unit="Volts">42.00</channel>
                <channel id="3" unit="Volts">42.00</channel>
                <channel id="4" unit="Volts">42.00</channel>
                <channel id="5" unit="Volts">42.00</channel>
                <channel id="6" unit="Volts">42.00</channel>
                <channel id="7" unit="Volts">42.00</channel>
                <channel id="8" unit="Volts">42.00</channel>
                <channel id="9" unit="Volts">42.00</channel>
                <channel id="10" unit="Volts">42.00</channel>
                <channel id="11" unit="Volts">42.00</channel>
                <channel id="12" unit="Volts">42.00</channel>
                <channel id="13" unit="Volts">42.00</channel>
                <channel id="14" unit="Volts">42.00</channel>
                <channel id="15" unit="Volts">42.00</channel>
                <channel id="16" unit="Volts">42.00</channel>
                <pedestal unit="Volts">42.00</pedestal>
            </hv>
        </settings> 
        
    </module>
    <module id="2" version="DM64_V2">
        <geometry>
            <size>1</size>
            <x>3</x>
            <y>5</y>
        </geometry>
                 
        <connection>
            <hvsys id='05'>
                <hv>
                    <id>2</id>
                </hv>
            </hvsys>
        </connection>    
        <settings>
            <hv>
                <channel id="1" unit="Volts">42.00</channel>
                <channel id="2" unit="Volts">42.00</channel>
                <channel id="3" unit="Volts">42.00</channel>
                <channel id="4" unit="Volts">42.00</channel>
                <channel id="5" unit="Volts">42.00</channel>
                <channel id="6" unit="Volts">42.00</channel>
                <channel id="7" unit="Volts">42.00</channel>
                <channel id="8" unit="Volts">42.00</channel>
                <channel id="9" unit="Volts">42.00</channel>
                <channel id="10" unit="Volts">42.00</channel>
                <channel id="11" unit="Volts">42.00</channel>
                <channel id="12" unit="Volts">42.00</channel>
                <channel id="13" unit="Volts">42.00</channel>
                <channel id="14" unit="Volts">42.00</channel>
                <channel id="15" unit="Volts">42.00</channel>
                <channel id="16" unit="Volts">42.00</channel>
                <pedestal unit="Volts">42.00</pedestal>
            </hv>
        </settings> 
    </module>
</config>
