<?xml version="1.0" encoding="UTF-8" standalone="no"?>
<config xmlns="http://www.w3schools.com" xmlns:xsi="http://www.w3.org/2001/XMLSchema-instance" created="17.02.2014" id="default" xsi:noNamespaceSchemaLocation="PsdSlowControlConfig.xsd" xsi:schemaLocation="PsdSlowControlConfig.xsd">
<global>
        <flags>
<onlineModules>1</onlineModules>
<onlineModules>2</onlineModules>
<onlineModules>3</onlineModules>
<onlineModules>4</onlineModules>
<onlineModules>5</onlineModules>
<onlineModules>6</onlineModules>
<onlineModules>7</onlineModules>
<onlineModules>8</onlineModules>
<onlineModules>9</onlineModules>

            <queryDelay unit="sec">600</queryDelay>
            <verbose> 1 </verbose>
            <useVoiceNotifications> 0 </useVoiceNotifications>
            <voiceServer> na61daqt </voiceServer>
            <monitorHV> 0 </monitorHV>
            <refTemp> 25 </refTemp>
            <tempSlope> 60 </tempSlope>

        </flags>
        <connection>
		<hvsys>
		        <rate unit="baud">57600</rate>
                        <port>10.0.9.3</port>
		        <dataBits>8</dataBits>
		        <stopBits>1</stopBits>
		        <parity>0</parity>		        
		</hvsys>
		</connection>
		<settings>
		    <hv>
		        <base unit="Volts">64.0</base>
		    </hv>
		</settings>
    </global>
    
<module id="1">
    	<geometry>
    	    <size>1</size>
    	    <x>8</x>
            <y>4</y>
    	</geometry>
    	    	 
    	<connection>
			<hvsys>
				<hv>
				    <id>1</id>
				</hv>
			</hvsys>
    	        	</connection>    
    	<settings>
			<hv>
                <channel id="1" unit="Volts">50</channel>
				<channel id="2" unit="Volts">69.89</channel>
				<channel id="3" unit="Volts">69.89</channel>
				<channel id="4" unit="Volts">69.89</channel>
				<channel id="5" unit="Volts">69.89</channel>
				<channel id="6" unit="Volts">69.89</channel>
				<channel id="7" unit="Volts">69.89</channel>
				<channel id="8" unit="Volts">69.89</channel>
				<channel id="9" unit="Volts">69.89</channel>
				<channel id="10" unit="Volts">69.89</channel>
                <pedestal unit="Volts">69.89</pedestal>
			</hv>
    	</settings> 
    	
    </module>
<module id="2">
    	<geometry>
    	    <size>1</size>
    	    <x>7</x>
    	   	<y>4</y>
    	</geometry>
    	    	 
    	<connection>
			<hvsys>
				<hv>
				    <id>2</id>
				</hv>
			</hvsys>
    	        	</connection>    
    	<settings>
			<hv>
				<channel id="1" unit="Volts">69.91</channel>
				<channel id="2" unit="Volts">69.91</channel>
				<channel id="3" unit="Volts">69.91</channel>
				<channel id="4" unit="Volts">69.91</channel>
				<channel id="5" unit="Volts">69.91</channel>
				<channel id="6" unit="Volts">69.91</channel>
				<channel id="7" unit="Volts">69.91</channel>
				<channel id="8" unit="Volts">69.91</channel>
				<channel id="9" unit="Volts">69.91</channel>
				<channel id="10" unit="Volts">69.91</channel>
                                <pedestal unit="Volts">69.91</pedestal>
			</hv>
    	</settings> 
    	
    </module>
<module id="3">
    	<geometry>
    	    <size>1</size>
    	    <x>6</x>
    	   	<y>4</y>
    	</geometry>
    	    	 
    	<connection>
			<hvsys>
				<hv>
				    <id>3</id>
				</hv>
			</hvsys>
    	        	</connection>    
    	<settings>
			<hv>
				<channel id="1" unit="Volts">71.07</channel>
				<channel id="2" unit="Volts">71.07</channel>
				<channel id="3" unit="Volts">71.07</channel>
				<channel id="4" unit="Volts">71.07</channel>
				<channel id="5" unit="Volts">71.07</channel>
				<channel id="6" unit="Volts">71.07</channel>
				<channel id="7" unit="Volts">71.07</channel>
				<channel id="8" unit="Volts">71.07</channel>
				<channel id="9" unit="Volts">71.07</channel>
				<channel id="10" unit="Volts">71.07</channel> 
                                <pedestal unit="Volts">71.07</pedestal>
			</hv>
    	</settings> 
    	
    </module>
<module id="4">
    	<geometry>
    	    <size>1</size>
    	    <x>8</x>
    	   	<y>5</y>
    	</geometry>
    	    	 
    	<connection>
			<hvsys>
				<hv>
				    <id>4</id>
				</hv>
			</hvsys>
    	        	</connection>    
    	<settings>
			<hv>
				<channel id="1" unit="Volts">69.99</channel>
				<channel id="2" unit="Volts">69.99</channel>
				<channel id="3" unit="Volts">69.99</channel>
				<channel id="4" unit="Volts">69.99</channel>
				<channel id="5" unit="Volts">69.99</channel>
				<channel id="6" unit="Volts">69.99</channel>
				<channel id="7" unit="Volts">69.99</channel>
				<channel id="8" unit="Volts">69.99</channel>
				<channel id="9" unit="Volts">69.99</channel>
				<channel id="10" unit="Volts">69.99</channel> 
                                <pedestal unit="Volts">69.99</pedestal>
			</hv>
    	</settings> 
    	
    </module>
<module id="5">
    	<geometry>
    	    <size>1</size>
    	    <x>7</x>
    	   	<y>5</y>
    	</geometry>
    	    	 
    	<connection>
			<hvsys>
				<hv>
				    <id>5</id>
				</hv>
			</hvsys>
    	        	</connection>    
    	<settings>
			<hv>
				<channel id="1" unit="Volts">69.99</channel>
				<channel id="2" unit="Volts">69.99</channel>
				<channel id="3" unit="Volts">69.99</channel>
				<channel id="4" unit="Volts">69.99</channel>
				<channel id="5" unit="Volts">69.99</channel>
				<channel id="6" unit="Volts">69.99</channel>
				<channel id="7" unit="Volts">69.99</channel>
				<channel id="8" unit="Volts">69.99</channel>
				<channel id="9" unit="Volts">69.99</channel>
				<channel id="10" unit="Volts">69.99</channel> 
                                <pedestal unit="Volts">69.99</pedestal>
			</hv>
    	</settings> 
    	
    </module>
<module id="6">
    	<geometry>
    	    <size>1</size>
    	    <x>6</x>
    	   	<y>5</y>
    	</geometry>
    	    	 
    	<connection>
			<hvsys>
				<hv>
				    <id>6</id>
				</hv>
			</hvsys>
    	        	</connection>    
    	<settings>
			<hv>
				<channel id="1" unit="Volts">69.94</channel>
				<channel id="2" unit="Volts">69.94</channel>
				<channel id="3" unit="Volts">69.94</channel>
				<channel id="4" unit="Volts">69.94</channel>
				<channel id="5" unit="Volts">69.94</channel>
				<channel id="6" unit="Volts">69.94</channel>
				<channel id="7" unit="Volts">69.94</channel>
				<channel id="8" unit="Volts">69.94</channel>
				<channel id="9" unit="Volts">69.94</channel>
				<channel id="10" unit="Volts">69.94</channel> 
                                <pedestal unit="Volts">69.94</pedestal>
			</hv>
    	</settings> 
    	
    </module>
<module id="7">
    	<geometry>
    	    <size>1</size>
    	    <x>8</x>
    	   	<y>6</y>
    	</geometry>
    	    	 
    	<connection>
			<hvsys>
				<hv>
				    <id>7</id>
				</hv>
			</hvsys>
    	        	</connection>    
    	<settings>
			<hv>
				<channel id="1" unit="Volts">71.10</channel>
				<channel id="2" unit="Volts">71.10</channel>
				<channel id="3" unit="Volts">71.10</channel>
				<channel id="4" unit="Volts">71.10</channel>
				<channel id="5" unit="Volts">71.10</channel>
				<channel id="6" unit="Volts">71.10</channel>
				<channel id="7" unit="Volts">71.10</channel>
				<channel id="8" unit="Volts">71.10</channel>
				<channel id="9" unit="Volts">71.10</channel>
				<channel id="10" unit="Volts">71.10</channel> 
                                <pedestal unit="Volts">71.10</pedestal>
			</hv>
    	</settings> 
    	
    </module>
<module id="8">
    	<geometry>
    	    <size>1</size>
    	    <x>7</x>
    	   	<y>6</y>
    	</geometry>
    	    	 
    	<connection>
			<hvsys>
				<hv>
				    <id>8</id>
				</hv>
			</hvsys>
    	        	</connection>    
    	<settings>
			<hv>
				<channel id="1" unit="Volts">71.15</channel>
				<channel id="2" unit="Volts">71.15</channel>
				<channel id="3" unit="Volts">71.15</channel>
				<channel id="4" unit="Volts">71.15</channel>
				<channel id="5" unit="Volts">71.15</channel>
				<channel id="6" unit="Volts">71.15</channel>
				<channel id="7" unit="Volts">71.15</channel>
				<channel id="8" unit="Volts">71.15</channel>
				<channel id="9" unit="Volts">71.15</channel>
				<channel id="10" unit="Volts">71.15</channel> 
                                <pedestal unit="Volts">71.15</pedestal>
			</hv>
    	</settings> 
    	
    </module>
<module id="9">
    	<geometry>
    	    <size>1</size>
    	    <x>6</x>
    	   	<y>6</y>
    	</geometry>
    	    	 
    	<connection>
			<hvsys>
				<hv>
				    <id>9</id>
				</hv>
			</hvsys>
    	        	</connection>    
    	<settings>
			<hv>
				<channel id="1" unit="Volts">71.03</channel>
				<channel id="2" unit="Volts">71.03</channel>
				<channel id="3" unit="Volts">71.03</channel>
				<channel id="4" unit="Volts">71.03</channel>
				<channel id="5" unit="Volts">71.03</channel>
				<channel id="6" unit="Volts">71.03</channel>
				<channel id="7" unit="Volts">71.03</channel>
				<channel id="8" unit="Volts">71.03</channel>
				<channel id="9" unit="Volts">71.03</channel>
				<channel id="10" unit="Volts">71.03</channel> 
                                <pedestal unit="Volts">71.03</pedestal>
			</hv>
    	</settings> 
    </module>
</config>
