<?xml version="1.0" encoding="UTF-8" standalone="no"?>
<config xmlns="http://www.w3schools.com" xmlns:xsi="http://www.w3.org/2001/XMLSchema-instance" created="17.02.2014" id="default" xsi:noNamespaceSchemaLocation="PsdSlowControlConfig.xsd" xsi:schemaLocation="PsdSlowControlConfig.xsd">
<global>
	<title>hodo DCS</title>
	<flags>
            <onlineModules> 141,142,143,144 </onlineModules>

            <queryDelay unit="sec">600</queryDelay>
            <verbose> 1 </verbose>
            <monitorHV> 0 </monitorHV>
            <refTemp> 25 </refTemp>
            <tempSlope> 60 </tempSlope>

        </flags>
        <connection>
        <hvsys id="fhcal">
                <rate unit="baud">57600</rate>
                <port>10.18.88.134</port>
                <dataBits>8</dataBits>
                <stopBits>1</stopBits>
                <parity>0</parity>                
        </hvsys>
        </connection>
        <settings>
            <hv>
                <base unit="Volts">64.0</base>
            </hv>
        </settings>
    </global>

    <module id="141">
        <geometry>
            <size>1</size>
            <x>1</x>
            <y>7</y>
        </geometry>
                 
        <connection>
            <hvsys id="fhcal">
                <hv>
                    <id>141</id>
                </hv>
            </hvsys>
        </connection>    
        <settings>
            <hv>
                <channel id="1" unit="Volts">42.0</channel>
                <channel id="2" unit="Volts">42.0</channel>
                <channel id="3" unit="Volts">42.0</channel>
                <channel id="4" unit="Volts">42.0</channel>
                <channel id="5" unit="Volts">42.0</channel>
                <channel id="6" unit="Volts">42.0</channel>
                <channel id="7" unit="Volts">42.0</channel>
                <channel id="8" unit="Volts">42.0</channel>
                <pedestal unit="Volts">42.0</pedestal>
            </hv>
        </settings> 
        
    </module>

    <module id="142" temperature_from_module="141">
        <geometry>
            <size>1</size>
            <x>2</x>
            <y>7</y>
        </geometry>
                 
        <connection>
            <hvsys id="fhcal">
                <hv>
                    <id>142</id>
                </hv>
            </hvsys>
        </connection>    
        <settings>
            <hv>
                <channel id="1" unit="Volts">42.0</channel>
                <channel id="2" unit="Volts">42.0</channel>
                <channel id="3" unit="Volts">42.0</channel>
                <channel id="4" unit="Volts">42.0</channel>
                <channel id="5" unit="Volts">42.0</channel>
                <channel id="6" unit="Volts">42.0</channel>
                <channel id="7" unit="Volts">42.0</channel>
                <channel id="8" unit="Volts">42.0</channel>
                <pedestal unit="Volts">42.0</pedestal>
            </hv>
        </settings> 
        
    </module>

    <module id="143" temperature_from_module="141">
        <geometry>
            <size>1</size>
            <x>3</x>
            <y>7</y>
        </geometry>
                 
        <connection>
            <hvsys id="fhcal">
                <hv>
                    <id>143</id>
                </hv>
            </hvsys>
        </connection>    
        <settings>
            <hv>
                <channel id="1" unit="Volts">42.0</channel>
                <channel id="2" unit="Volts">42.0</channel>
                <channel id="3" unit="Volts">42.0</channel>
                <channel id="4" unit="Volts">42.0</channel>
                <channel id="5" unit="Volts">42.0</channel>
                <channel id="6" unit="Volts">42.0</channel>
                <channel id="7" unit="Volts">42.0</channel>
                <channel id="8" unit="Volts">42.0</channel>
                <pedestal unit="Volts">42.0</pedestal>
            </hv>
        </settings> 
        
    </module>

    <module id="144" temperature_from_module="144">
        <geometry>
            <size>1</size>
            <x>4</x>
            <y>7</y>
        </geometry>
                 
        <connection>
            <hvsys id="fhcal">
                <hv>
                    <id>144</id>
                </hv>
            </hvsys>
        </connection>    
        <settings>
            <hv>
                <channel id="1" unit="Volts">42.0</channel>
                <channel id="2" unit="Volts">42.0</channel>
                <channel id="3" unit="Volts">42.0</channel>
                <channel id="4" unit="Volts">42.0</channel>
                <channel id="5" unit="Volts">42.0</channel>
                <channel id="6" unit="Volts">42.0</channel>
                <channel id="7" unit="Volts">42.0</channel>
                <channel id="8" unit="Volts">42.0</channel>
                <pedestal unit="Volts">42.0</pedestal>
            </hv>
        </settings> 
        
    </module>


</config>

